code,concept,description,class_code,feature_class
CAVE,cave(s),"an underground passageway or chamber, or cavity on the side of a cliff",S.CAVE,S
CH,church,a building for public Christian worship,S.CH,S
CMP,camp(s),"a site occupied by tents, huts, or other shelters for temporary use",S.CMP,S
CMPL,logging camp,a camp used by loggers,S.CMPL,S
CMPLA,labor camp,a camp used by migrant or temporary laborers,S.CMPLA,S
CMPMN,mining camp,a camp used by miners,S.CMPMN,S
CMPO,oil camp,a camp used by oilfield workers,S.CMPO,S
CMPQ,abandoned camp,,S.CMPQ,S
CMPRF,refugee camp,a camp used by refugees,S.CMPRF,S
CMTY,cemetery,a burial place or ground,S.CMTY,S
COMC,communication center,"a facility, including buildings, antennae, towers and electronic equipment for receiving and transmitting information",S.COMC,S
CRRL,corral(s),a pen or enclosure for confining or capturing animals,S.CRRL,S
CSNO,casino,"a building used for entertainment, especially gambling",S.CSNO,S
CSTL,castle,a large fortified building or set of buildings,S.CSTL,S
CSTM,customs house,"a building in a port where customs and duties are paid, and where vessels are entered and cleared",S.CSTM,S
CTHSE,courthouse,a building in which courts of law are held,S.CTHSE,S
CTRA,atomic center,a facility where atomic research is carried out,S.CTRA,S
CTRCM,community center,a facility for community recreation and other activities,S.CTRCM,S
CTRF,facility center,a place where more than one facility is situated,S.CTRF,S
CTRM,medical center,"a complex of health care buildings including two or more of the following: hospital, medical school, clinic, pharmacy, doctor's offices, etc.",S.CTRM,S
CTRR,religious center,"a facility where more than one religious activity is carried out, e.g., retreat, school, monastery, worship",S.CTRR,S
CTRS,space center,"a facility for launching, tracking, or controlling satellites and space vehicles",S.CTRS,S
CTYD,courtyard,an area surrounded by a building or complex and open to the sky,S.CTYD,S
CVNT,convent,a building where a community of nuns lives in seclusion,S.CVNT,S
DAM,dam,a barrier constructed across a stream to impound water,S.DAM,S
DAMQ,ruined dam,a destroyed or decayed dam which is no longer functional,S.DAMQ,S
DAMSB,sub-surface dam,a dam put down to bedrock in a sand river,S.DAMSB,S
DARY,dairy,"a facility for the processing, sale and distribution of milk or milk products",S.DARY,S
DCKD,dry dock,"a dock providing support for a vessel, and means for removing the water so that the bottom of the vessel can be exposed",S.DCKD,S
DCKY,dockyard,"a facility for servicing, building, or repairing ships",S.DCKY,S
DIKE,dike,an earth or stone embankment usually constructed for flood or stream control,S.DIKE,S
DIP,diplomatic facility,"office, residence, or facility of a foreign government, which may include an embassy, consulate, chancery, office of charge d'affaires, or other diplomatic, economic, military, or cultural mission",S.DIP,S
DPOF,fuel depot,an area where fuel is stored,S.DPOF,S
EST,estate(s),a large commercialized agricultural landholding with associated buildings and other facilities,S.EST,S
ESTO,oil palm plantation,an estate specializing in the cultivation of oil palm trees,S.ESTO,S
ESTR,rubber plantation,an estate which specializes in growing and tapping rubber trees,S.ESTR,S
ESTSG,sugar plantation,an estate that specializes in growing sugar cane,S.ESTSG,S
ESTT,tea plantation,an estate which specializes in growing tea bushes,S.ESTT,S
ESTX,section of estate,,S.ESTX,S
FCL,facility,"a building or buildings housing a center, institute, foundation, hospital, prison, mission, courthouse, etc.",S.FCL,S
FIRE,fire station,building housing firefighters and/or fire fighting equipment,S.FIRE,S
FNDY,foundry,a building or works where metal casting is carried out,S.FNDY,S
FRM,farm,a tract of land with associated buildings devoted to agriculture,S.FRM,S
FRMQ,abandoned farm,,S.FRMQ,S
FRMS,farms,tracts of land with associated buildings devoted to agriculture,S.FRMS,S
FRMT,farmstead,the buildings and adjacent service areas of a farm,S.FRMT,S
FT,fort,a defensive structure or earthworks,S.FT,S
FY,ferry,a boat or other floating conveyance and terminal facilities regularly used to transport people and vehicles across a waterbody,S.FY,S
FYT,ferry terminal,"a place where ferries pick-up and discharge passengers, vehicles and or cargo",S.FYT,S
GATE,gate,a controlled access entrance or exit,S.GATE,S
GDN,garden(s),an enclosure for displaying selected plant or animal life,S.GDN,S
GHAT,ghat,"a set of steps leading to a river, which are of religious significance, and at their base is usually a platform for bathing",S.GHAT,S
GHSE,guest house,a house used to provide lodging for paying guests,S.GHSE,S
GOSP,gas-oil separator plant,a facility for separating gas from oil,S.GOSP,S
GOVL,local government office,"a facility housing local governmental offices, usually a city, town, or village hall",S.GOVL,S
GRVE,grave,a burial site,S.GRVE,S
HERM,hermitage,"a secluded residence, usually for religious sects",S.HERM,S
HLT,halting place,a place where caravans stop for rest,S.HLT,S
HMSD,homestead,"a residence, owner's or manager's, on a sheep or cattle station, woolshed, outcamp, or Aboriginal outstation, specific to Australia and New Zealand ",S.HMSD,S
HSE,house(s),a building used as a human habitation,S.HSE,S
HSEC,country house,"a large house, mansion, or chateau, on a large estate",S.HSEC,S
HSP,hospital,"a building in which sick or injured, especially those confined to bed, are medically treated",S.HSP,S
HSPC,clinic,a medical facility associated with a hospital for outpatients,S.HSPC,S
HSPD,dispensary,a building where medical or dental aid is dispensed,S.HSPD,S
HSPL,leprosarium,an asylum or hospital for lepers,S.HSPL,S
HSTS,historical site,a place of historical importance,S.HSTS,S
HTL,hotel,a building providing lodging and/or meals for the public,S.HTL,S
HUT,hut,a small primitive house,S.HUT,S
HUTS,huts,small primitive houses,S.HUTS,S
INSM,military installation,a facility for use of and control by armed forces,S.INSM,S
ITTR,research institute,a facility where research is carried out,S.ITTR,S
JTY,jetty,a structure built out into the water at a river mouth or harbor entrance to regulate currents and silting,S.JTY,S
LDNG,landing,"a place where boats receive or discharge passengers and freight, but lacking most port facilities",S.LDNG,S
LEPC,leper colony,a settled area inhabited by lepers in relative isolation,S.LEPC,S
LIBR,library,"A place in which information resources such as books are kept for reading, reference, or lending.",S.LIBR,S
LNDF,landfill,a place for trash and garbage disposal in which the waste is buried between layers of earth to build up low-lying land,S.LNDF,S
LOCK,lock(s),a basin in a waterway with gates at each end by means of which vessels are passed from one water level to another,S.LOCK,S
LTHSE,lighthouse,a distinctive structure exhibiting a major navigation light,S.LTHSE,S
MALL,mall,"A large, often enclosed shopping complex containing various stores, businesses, and restaurants usually accessible by common passageways.",S.MALL,S
MAR,marina,"a harbor facility for small boats, yachts, etc.",S.MAR,S
MFG,factory,"one or more buildings where goods are manufactured, processed or fabricated",S.MFG,S
MFGB,brewery,one or more buildings where beer is brewed,S.MFGB,S
MFGC,cannery,a building where food items are canned,S.MFGC,S
MFGCU,copper works,a facility for processing copper ore,S.MFGCU,S
MFGLM,limekiln,a furnace in which limestone is reduced to lime,S.MFGLM,S
MFGM,munitions plant,a factory where ammunition is made,S.MFGM,S
MFGPH,phosphate works,a facility for producing fertilizer,S.MFGPH,S
MFGQ,abandoned factory,,S.MFGQ,S
MFGSG,sugar refinery,a facility for converting raw sugar into refined sugar,S.MFGSG,S
MKT,market,a place where goods are bought and sold at regular intervals,S.MKT,S
ML,mill(s),"a building housing machines for transforming, shaping, finishing, grinding, or extracting products",S.ML,S
MLM,ore treatment plant,a facility for improving the metal content of ore by concentration,S.MLM,S
MLO,olive oil mill,a mill where oil is extracted from olives,S.MLO,S
MLSG,sugar mill,a facility where sugar cane is processed into raw sugar,S.MLSG,S
MLSGQ,former sugar mill,a sugar mill no longer used as a sugar mill,S.MLSGQ,S
MLSW,sawmill,a mill where logs or lumber are sawn to specified shapes and sizes,S.MLSW,S
MLWND,windmill,a mill or water pump powered by wind,S.MLWND,S
MLWTR,water mill,a mill powered by running water,S.MLWTR,S
MN,mine(s),a site where mineral ores are extracted from the ground by excavating surface pits and subterranean passages,S.MN,S
MNAU,gold mine(s),"a mine where gold ore, or alluvial gold is extracted",S.MNAU,S
MNC,coal mine(s),a mine where coal is extracted,S.MNC,S
MNCR,chrome mine(s),a mine where chrome ore is extracted,S.MNCR,S
MNCU,copper mine(s),a mine where copper ore is extracted,S.MNCU,S
MNFE,iron mine(s),a mine where iron ore is extracted,S.MNFE,S
MNMT,monument,a commemorative structure or statue,S.MNMT,S
MNN,salt mine(s),a mine from which salt is extracted,S.MNN,S
MNQ,abandoned mine,,S.MNQ,S
MNQR,quarry(-ies),"a surface mine where building stone or gravel and sand, etc. are extracted",S.MNQR,S
MOLE,mole,a massive structure of masonry or large stones serving as a pier or breakwater,S.MOLE,S
MSQE,mosque,a building for public Islamic worship,S.MSQE,S
MSSN,mission,"a place characterized by dwellings, school, church, hospital and other facilities operated by a religious group for the purpose of providing charitable services and to propagate religion",S.MSSN,S
MSSNQ,abandoned mission,,S.MSSNQ,S
MSTY,monastery,a building and grounds where a community of monks lives in seclusion,S.MSTY,S
MTRO,metro station,"metro station (Underground, Tube, or Metro) ",S.MTRO,S
MUS,museum,a building where objects of permanent interest in one or more of the arts and sciences are preserved and exhibited,S.MUS,S
NOV,novitiate,a religious house or school where novices are trained,S.NOV,S
NSY,nursery(-ies),a place where plants are propagated for transplanting or grafting,S.NSY,S
OBPT,observation point,a wildlife or scenic observation point,S.OBPT,S
OBS,observatory,a facility equipped for observation of atmospheric or space phenomena,S.OBS,S
OBSR,radio observatory,a facility equipped with an array of antennae for receiving radio waves from space,S.OBSR,S
OILJ,oil pipeline junction,a section of an oil pipeline where two or more pipes join together,S.OILJ,S
OILQ,abandoned oil well,,S.OILQ,S
OILR,oil refinery,a facility for converting crude oil into refined petroleum products,S.OILR,S
OILT,tank farm,"a tract of land occupied by large, cylindrical, metal tanks in which oil or liquid petrochemicals are stored",S.OILT,S
OILW,oil well,a well from which oil may be pumped,S.OILW,S
OPRA,opera house,A theater designed chiefly for the performance of operas.,S.OPRA,S
PAL,palace,"a large stately house, often a royal or presidential residence",S.PAL,S
PGDA,pagoda,"a tower-like storied structure, usually a Buddhist shrine",S.PGDA,S
PIER,pier,a structure built out into navigable water on piles providing berthing for ships and recreation,S.PIER,S
PKLT,parking lot,an area used for parking vehicles,S.PKLT,S
PMPO,oil pumping station,a facility for pumping oil through a pipeline,S.PMPO,S
PMPW,water pumping station,a facility for pumping water from a major well or through a pipeline,S.PMPW,S
PO,post office,"a public building in which mail is received, sorted and distributed",S.PO,S
PP,police post,a building in which police are stationed,S.PP,S
PPQ,abandoned police post,,S.PPQ,S
PRKGT,park gate,a controlled access to a park,S.PRKGT,S
PRKHQ,park headquarters,a park administrative facility,S.PRKHQ,S
PRN,prison,a facility for confining prisoners,S.PRN,S
PRNJ,reformatory,"a facility for confining, training, and reforming young law offenders",S.PRNJ,S
PRNQ,abandoned prison,,S.PRNQ,S
PS,power station,a facility for generating electric power,S.PS,S
PSH,hydroelectric power station,a building where electricity is generated from water power,S.PSH,S
PSN,nuclear power station,nuclear power station,S.PSN,S
PSTB,border post,a post or station at an international boundary for the regulation of movement of people and goods,S.PSTB,S
PSTC,customs post,a building at an international boundary where customs and duties are paid on goods,S.PSTC,S
PSTP,patrol post,a post from which patrols are sent out,S.PSTP,S
PYR,pyramid,an ancient massive structure of square ground plan with four triangular faces meeting at a point and used for enclosing tombs,S.PYR,S
PYRS,pyramids,ancient massive structures of square ground plan with four triangular faces meeting at a point and used for enclosing tombs,S.PYRS,S
QUAY,quay,a structure of solid construction along a shore or bank which provides berthing for ships and which generally provides cargo handling facilities,S.QUAY,S
RDCR,traffic circle,a road junction formed around a central circle about which traffic moves in one direction only,S.RDCR,S
RDIN,intersection,a junction of two or more highways by a system of separate levels that permit traffic to pass from one to another without the crossing of traffic streams,S.RDIN,S
RECG,golf course,a recreation field where golf is played,S.RECG,S
RECR,racetrack,a track where races are held,S.RECR,S
REST,restaurant,A place where meals are served to the public,S.REST,S
RET,store,a building where goods and/or services are offered for sale,S.RET,S
RHSE,resthouse,a structure maintained for the rest and shelter of travelers,S.RHSE,S
RKRY,rookery,a breeding place of a colony of birds or seals,S.RKRY,S
RLG,religious site,an ancient site of significant religious importance,S.RLG,S
RLGR,retreat,"a place of temporary seclusion, especially for religious groups",S.RLGR,S
RNCH,ranch(es),a large farm specializing in extensive grazing of livestock,S.RNCH,S
RSD,railroad siding,a short track parallel to and joining the main track,S.RSD,S
RSGNL,railroad signal,a signal at the entrance of a particular section of track governing the movement of trains,S.RSGNL,S
RSRT,resort,"a specialized facility for vacation, health, or participation sports activities",S.RSRT,S
RSTN,railroad station,"a facility comprising ticket office, platforms, etc. for loading and unloading train passengers and freight",S.RSTN,S
RSTNQ,abandoned railroad station,,S.RSTNQ,S
RSTP,railroad stop,a place lacking station facilities where trains stop to pick up and unload passengers and freight,S.RSTP,S
RSTPQ,abandoned railroad stop,,S.RSTPQ,S
RUIN,ruin(s),a destroyed or decayed structure which is no longer functional,S.RUIN,S
SCH,school,building(s) where instruction in one or more branches of knowledge takes place,S.SCH,S
SCHA,agricultural school,a school with a curriculum focused on agriculture,S.SCHA,S
SCHC,college,the grounds and buildings of an institution of higher learning,S.SCHC,S
SCHL,language school,Language Schools & Institutions,S.SCHL,S
SCHM,military school,a school at which military science forms the core of the curriculum,S.SCHM,S
SCHN,maritime school,a school at which maritime sciences form the core of the curriculum,S.SCHN,S
SCHT,technical school,post-secondary school with a specifically technical or vocational curriculum,S.SCHT,S
SECP,State Exam Prep Centre,state exam preparation centres,S.SECP,S
SHPF,sheepfold,a fence or wall enclosure for sheep and other small herd animals,S.SHPF,S
SHRN,shrine,a structure or place memorializing a person or religious concept,S.SHRN,S
SHSE,storehouse,"a building for storing goods, especially provisions",S.SHSE,S
SLCE,sluice,"a conduit or passage for carrying off surplus water from a waterbody, usually regulated by means of a sluice gate",S.SLCE,S
SNTR,sanatorium,a facility where victims of physical or mental disorders are treated,S.SNTR,S
SPA,spa,a resort area usually developed around a medicinal spring,S.SPA,S
SPLY,spillway,"a passage or outlet through which surplus water flows over, around or through a dam",S.SPLY,S
SQR,square,"a broad, open, public area near the center of a town or city",S.SQR,S
STBL,stable,"a building for the shelter and feeding of farm animals, especially horses",S.STBL,S
STDM,stadium,a structure with an enclosure for athletic games with tiers of seats for spectators,S.STDM,S
STNB,scientific research base,a scientific facility used as a base from which research is carried out or monitored,S.STNB,S
STNC,coast guard station,a facility from which the coast is guarded by armed vessels,S.STNC,S
STNE,experiment station,a facility for carrying out experiments,S.STNE,S
STNF,forest station,a collection of buildings and facilities for carrying out forest management,S.STNF,S
STNI,inspection station,"a station at which vehicles, goods, and people are inspected",S.STNI,S
STNM,meteorological station,a station at which weather elements are recorded,S.STNM,S
STNR,radio station,a facility for producing and transmitting information by radio waves,S.STNR,S
STNS,satellite station,a facility for tracking and communicating with orbiting satellites,S.STNS,S
STNW,whaling station,a facility for butchering whales and processing train oil,S.STNW,S
STPS,steps,stones or slabs placed for ease in ascending or descending a steep slope,S.STPS,S
SWT,sewage treatment plant,facility for the processing of sewage and/or wastewater,S.SWT,S
SYG,synagogue,a place for Jewish worship and religious instruction,S.SYG,S
THTR,theater,"a building or outdoor area used for live theatrical presentations, concerts, opera or dance productions, cinema, and/or other stage productions",S.THTR,S
TMB,tomb(s),a structure for interring bodies,S.TMB,S
TMPL,temple(s),an edifice dedicated to religious worship,S.TMPL,S
TNKD,cattle dipping tank,a small artificial pond used for immersing cattle in chemically treated water for disease control,S.TNKD,S
TOLL,toll gate/barrier,highway toll collection station,S.TOLL,S
TOWR,tower,"a high conspicuous structure, typically much higher than its diameter",S.TOWR,S
TRAM,tram,rail vehicle along urban streets (also known as streetcar or trolley),S.TRAM,S
TRANT,transit terminal,facilities for the handling of vehicular freight and passengers,S.TRANT,S
TRIG,triangulation station,a point on the earth whose position has been determined by triangulation,S.TRIG,S
TRMO,oil pipeline terminal,a tank farm or loading facility at the end of an oil pipeline,S.TRMO,S
TWO,temp work office,Temporary Work Offices,S.TWO,S
UNIP,university prep school,University Preparation Schools & Institutions,S.UNIP,S
UNIV,university,An institution for higher learning with teaching and research facilities constituting a graduate school and professional schools that award master's degrees and doctorates and an undergraduate division that awards bachelor's degrees.,S.UNIV,S
USGE,united states government establishment,a facility operated by the United States Government in Panama,S.USGE,S
VETF,veterinary facility,a building or camp at which veterinary services are available,S.VETF,S
WALL,wall,"a thick masonry structure, usually enclosing a field or building, or forming the side of a structure",S.WALL,S
WALLA,ancient wall,the remains of a linear defensive stone structure,S.WALLA,S
WEIR,weir(s),"a small dam in a stream, designed to raise the water level or to divert stream flow through a desired channel",S.WEIR,S
WHRF,wharf(-ves),a structure of open rather than solid construction along a shore or a bank which provides berthing for ships and cargo-handling facilities,S.WHRF,S
WRCK,wreck,the site of the remains of a wrecked vessel,S.WRCK,S
WTRW,waterworks,a facility for supplying potable water through a water source and a system of pumps and filtration beds,S.WTRW,S
ZNF,free trade zone,"an area, usually a section of a port, where goods may be received and shipped free of customs duty and of most customs regulations",S.ZNF,S
ZOO,zoo,a zoological garden or park where wild animals are kept for exhibition,S.ZOO,S
ASPH,asphalt lake,a small basin containing naturally occurring asphalt,T.ASPH,T
ATOL,atoll(s),a ring-shaped coral reef which has closely spaced islands on it encircling a lagoon,T.ATOL,T
BAR,bar,"a shallow ridge or mound of coarse unconsolidated material in a stream channel, at the mouth of a stream, estuary, or lagoon and in the wave-break zone along coasts",T.BAR,T
BCH,beach,a shore zone of coarse unconsolidated sediment that extends from the low-water line to the highest reach of storm waves,T.BCH,T
BCHS,beaches,a shore zone of coarse unconsolidated sediment that extends from the low-water line to the highest reach of storm waves,T.BCHS,T
BDLD,badlands,"an area characterized by a maze of very closely spaced, deep, narrow, steep-sided ravines, and sharp crests and pinnacles",T.BDLD,T
BLDR,boulder field,"a high altitude or high latitude bare, flat area covered with large angular rocks",T.BLDR,T
BLHL,blowhole(s),a hole in coastal rock through which sea water is forced by a rising tide or waves and spurted through an outlet into the air,T.BLHL,T
BLOW,blowout(s),"a small depression in sandy terrain, caused by wind erosion",T.BLOW,T
BNCH,bench,"a long, narrow bedrock platform bounded by steeper slopes above and below, usually overlooking a waterbody",T.BNCH,T
BUTE,butte(s),"a small, isolated, usually flat-topped hill with steep sides",T.BUTE,T
CAPE,cape,"a land area, more prominent than a point, projecting into the sea and marking a notable change in coastal direction",T.CAPE,T
CFT,cleft(s),"a deep narrow slot, notch, or groove in a coastal cliff",T.CFT,T
CLDA,caldera,a depression measuring kilometers across formed by the collapse of a volcanic mountain,T.CLDA,T
CLF,cliff(s),"a high, steep to perpendicular slope overlooking a waterbody or lower area",T.CLF,T
CNYN,canyon,"a deep, narrow valley with steep sides cutting into a plateau or mountainous area",T.CNYN,T
CONE,cone(s),a conical landform composed of mud or volcanic material,T.CONE,T
CRDR,corridor,a strip or area of land having significance as an access way,T.CRDR,T
CRQ,cirque,a bowl-like hollow partially surrounded by cliffs or steep slopes at the head of a glaciated valley,T.CRQ,T
CRQS,cirques,bowl-like hollows partially surrounded by cliffs or steep slopes at the head of a glaciated valley,T.CRQS,T
CRTR,crater(s),a generally circular saucer or bowl-shaped depression caused by volcanic or meteorite explosive action,T.CRTR,T
CUET,cuesta(s),an asymmetric ridge formed on tilted strata,T.CUET,T
DLTA,delta,a flat plain formed by alluvial deposits at the mouth of a stream,T.DLTA,T
DPR,depression(s),a low area surrounded by higher land and usually characterized by interior drainage,T.DPR,T
DSRT,desert,a large area with little or no vegetation due to extreme environmental conditions,T.DSRT,T
DUNE,dune(s),"a wave form, ridge or star shape feature composed of sand",T.DUNE,T
DVD,divide,a line separating adjacent drainage basins,T.DVD,T
ERG,sandy desert,an extensive tract of shifting sand and sand dunes,T.ERG,T
FAN,fan(s),a fan-shaped wedge of coarse alluvium with apex merging with a mountain stream bed and the fan spreading out at a low angle slope onto an adjacent plain,T.FAN,T
FORD,ford,a shallow part of a stream which can be crossed on foot or by land vehicle,T.FORD,T
FSR,fissure,a crack associated with volcanism,T.FSR,T
GAP,gap,"a low place in a ridge, not used for transportation",T.GAP,T
GRGE,gorge(s),"a short, narrow, steep-sided section of a stream valley",T.GRGE,T
HDLD,headland,a high projection of land extending into a large body of water beyond the line of the coast,T.HDLD,T
HLL,hill,a rounded elevation of limited extent rising above the surrounding land with local relief of less than 300m,T.HLL,T
HLLS,hills,rounded elevations of limited extent rising above the surrounding land with local relief of less than 300m,T.HLLS,T
HMCK,hammock(s),"a patch of ground, distinct from and slightly above the surrounding plain or wetland. Often occurs in groups",T.HMCK,T
HMDA,rock desert,"a relatively sand-free, high bedrock plateau in a hot desert, with or without a gravel veneer",T.HMDA,T
INTF,interfluve,a relatively undissected upland between adjacent stream valleys,T.INTF,T
ISL,island,"a tract of land, smaller than a continent, surrounded by water at high water",T.ISL,T
ISLET,islet,"small island, bigger than rock, smaller than island.",T.ISLET,T
ISLF,artificial island,"an island created by landfill or diking and filling in a wetland, bay, or lagoon",T.ISLF,T
ISLM,mangrove island,a mangrove swamp surrounded by a waterbody,T.ISLM,T
ISLS,islands,"tracts of land, smaller than a continent, surrounded by water at high water",T.ISLS,T
ISLT,land-tied island,"a coastal island connected to the mainland by barrier beaches, levees or dikes",T.ISLT,T
ISLX,section of island,,T.ISLX,T
ISTH,isthmus,a narrow strip of land connecting two larger land masses and bordered by water,T.ISTH,T
KRST,karst area,"a distinctive landscape developed on soluble rock such as limestone characterized by sinkholes, caves, disappearing streams, and underground drainage",T.KRST,T
LAVA,lava area,an area of solidified lava,T.LAVA,T
LEV,levee,a natural low embankment bordering a distributary or meandering stream; often built up artificially to control floods,T.LEV,T
MESA,mesa(s),"a flat-topped, isolated elevation with steep slopes on all sides, less extensive than a plateau",T.MESA,T
MND,mound(s),"a low, isolated, rounded hill",T.MND,T
MRN,moraine,"a mound, ridge, or other accumulation of glacial till",T.MRN,T
MT,mountain,"an elevation standing high above the surrounding area with small summit area, steep slopes and local relief of 300m or more",T.MT,T
MTS,mountains,a mountain range or a group of mountains or high ridges,T.MTS,T
NKM,meander neck,a narrow strip of land between the two limbs of a meander loop at its narrowest point,T.NKM,T
NTK,nunatak,a rock or mountain peak protruding through glacial ice,T.NTK,T
NTKS,nunataks,rocks or mountain peaks protruding through glacial ice,T.NTKS,T
