ResourceID,card,card_order,name_content,name_content_type,name_content_language,identifier_content,organisation_type,alt_names,other_identifier_content,other_identifier_type
956ab601-3a7f-571c-b37b-a2ba1694c967,religious_order,0,Liefdezusters van de Heilige Carolus Borromeus,Primary,Nederlands,https://n2t.net/ark:/15052/b03e6560-b562-46c4-ae0d-1e555f0b7d2b,Religious Order,"['Congregatie van de Liefdeszusters', 'S.M.C.B.', 'Liefdezusters van de H. Carolus Borromeus', 'Barmhartige Zusters van de Heilige Carolus Borromeus', 'Zusters Onder de Bogen', 'Bogenzusters', 'SMCB', 'Sorores Misericordiae Sancti Caroli Borromei', 'Liefdezusters van de Heilige Carolus Borromeus (Maastricht)', 'Liefdezusters van de H. Carolus Borromeus (Maastricht)', 'Zusters van de H. Vincentius a Paulo', 'Zusters van de Heilige Vincentius a Paulo', 'Liefdezusters CB', 'Zusters van Maastricht', 'Barmhartige Zusters van de H. Carolus Borromeus']",http://www.wikidata.org/entity/Q110474225,"""Brabant Cloud ARK Identifier"""
173c2df1-a671-5934-8b54-2f7e6874a949,religious_order,0,Dochters van de Goddelijke Voorzienigheid,Primary,Nederlands,https://n2t.net/ark:/15052/c294cc74-65f9-495a-8d1e-ae9bc6d692dc,Religious Order,Moeders der Armen,http://www.wikidata.org/entity/Q3744789,"""Brabant Cloud ARK Identifier"""
086b2328-6c28-54b3-94d2-963c2f243f4e,religious_order,0,Norbertinessen,Primary,Nederlands,https://n2t.net/ark:/15052/760b0e65-07d3-4d0d-840b-a038daa1ec80,Religious Order,"['Norbertinessen', 'Premonstratenzerinnen', 'OPraem', 'OPRAEM', 'Kanunnikessen van de Orde van Premonstreit', 'Ordo Praemonstratensis', 'Norbertinessen OPRAEM']",http://www.wikidata.org/entity/Q339332,"""Brabant Cloud ARK Identifier"""
110199f4-ae2c-5cbb-977a-06decb195dee,religious_order,0,Barmhartige Zusters van de Heilige Carolus Borromeus (F),Nederlands,Nederlands,https://n2t.net/ark:/15052/54e81627-e4eb-4011-9634-bbe2e8ef7449,Religious Order,"['Zusters van Barmhartigheid van de H. Carolus Borromeus', 'Zusters van Barmhartigheid van de Heilige Carolus Borromeus', 'Barmhartige Zusters van de H. Carolus Borromeus (F)', 'Soeurs de la Charité de St. Charles', 'Soeurs de la Ste. Famille de Jésus, Marie, Joseph']",,
b4885f08-6bdd-5f2c-8613-ed115cb8ee93,religious_order,0,Oblaten van de Onbevlekte Maagd Maria,Nederlands,Nederlands,https://n2t.net/ark:/15052/6e181da5-86a9-4db7-aec8-218408763abf,Religious Order,"['Missionarissen Oblaten van de Onbevlekte Maagd Maria OMI', 'Congregatio Missionariorum Oblatorum Beatae Mariae Virgini Immaculatae', 'O.M.I.', 'Oblaten van Maria', 'OMI']",http://www.wikidata.org/entity/Q1336967,Brabant Cloud ARK Identifier
b438ba11-f05c-53a7-a22f-c648cf2bfdd4,religious_order,0,Trappisten,Primary,Nederlands,https://n2t.net/ark:/15052/c9dbf3cc-9d2a-4f77-b63a-5c584e0212c1,Religious Order,"['Cisterciënzers van de Strenge Onderhouding', 'Hervormde Cisterciënzers', 'OCistR', 'OCistRef', 'OCR', 'Trappistenorde', 'O.C.S.O.', 'OCSO', 'Ordo Cisterciensis Strictioris Observantiae', 'Cisterciënzerorde van de Stricte Observantie']",http://www.wikidata.org/entity/Q276223,"""Brabant Cloud ARK Identifier"""
3cbaea6e-38b9-5d56-8e8a-966ec8b0868a,religious_order,0,Broeders van Onze-Lieve-Vrouw van Lourdes,Primary,Nederlands,https://n2t.net/ark:/15052/14573658-bdb7-471f-85dd-8617dca5ef27,Religious Order,"['Broeders van Onze Lieve Vrouw van Lourdes', 'Broeders van Oostakker', 'Broeders van de Goede Werken', 'Broeders van Goede Werken', 'Broeders van de H. Vincentius', 'Broeders van de Heilige Vincentius', 'Broeders van O.L. Vrouw van Lourdes', 'Broeders van Ronse', 'Congregatie van de Broeders van Goede Werken', 'Congregatio Fratrum Beatae Mariae Virginis de Lourdes', 'Broeders van Dongen']",http://www.wikidata.org/entity/Q996726,"""Brabant Cloud ARK Identifier"""
456b00a3-9c76-5a27-b769-dfc4a46440f4,religious_order,0,Augustijnen,Primary,Nederlands,https://n2t.net/ark:/15052/44272128-b69a-403f-bc49-ff456a8dfdc6,Religious Order,"['Augustijnen OSA', 'Augustijnerorde', 'Orde van Paters Augustijnen', 'Ordo Sancti Augustini', 'Reguliere Kanunniken van Augustinus', 'Orde van Sint Augustinus', 'Orde van Sint-Augustinus', 'Augustijnermonniken', 'Heremieten van Sint Augustinus', 'Heremieten van Sint-Augustinus', 'C.R.S.A.', 'CRSA', 'O.S.A.', 'OSA', 'Augustijnen Eremieten', 'Orde van de Augustijnen', 'Orde van de Eremieten van Sint Augustinus', 'Paters Augustijnen', 'Augustijnen', 'Augustijnen O.S.A.', 'Augustijner Heremieten', 'Ordo Eremitarum Sancti Augustini', 'OESA']",https://www.wikidata.org/entity/Q214528,"""Brabant Cloud ARK Identifier"""
67c9d840-eebb-5812-bc0d-b87b54a6d417,religious_order,0,Broeders van Liefde,Nederlands,Nederlands,https://n2t.net/ark:/15052/24f9af6d-9b19-405f-99ea-5eb18df67678,Religious Order,"['F.C.', 'Fratres Caritate', 'Hospitaalbroeders van de H. Vincentius', 'Hospitaalbroeders van de Heilige Vincentius', 'Congregatio Fratrum Caritatis', 'FC', 'Broeders van Liefde van Eindhoven', 'Broeders van Liefde van Gent', 'Congregatie van de Broeders van Liefde', 'Broeders van Liefde FC']",http://www.wikidata.org/entity/Q542127,Brabant Cloud ARK Identifier
aa8985ed-97bd-52cb-9792-2596ec17db49,religious_order,0,Zusters van de Heilige Juliana van Falconieri,Primary,Nederlands,https://n2t.net/ark:/15052/6053bc7f-66b7-4333-9fdb-3ef5ee84e430,Religious Order,"['Juliaantjes', 'Liefdezusters van de Heilige Juliana van Falconieri', 'Zusters van Liefde van de H. Juliana van Falconieri', 'Julianazusters']",http://www.wikidata.org/entity/Q114771098,"""Brabant Cloud ARK Identifier"""
27a9cffb-2a9a-5f55-9c65-e04af593e9c3,religious_order,0,Kapucijnen,Nederlands,Nederlands,https://n2t.net/ark:/15052/46dbb1a4-d573-4130-96eb-69c44ecb5c17,Religious Order,"['Franciscaner Orde der Minderbroeders Kapucijnen', 'Ordo Fratrum Minorum Capuccinorum', 'Minderbroeders Kapucijnen', 'O.F.M.Cap.', 'OFMCap', 'Kapucijnen OFMCAP', 'Capucijnen', 'Minderbroeders Capucijnen', 'OMCap']",https://www.wikidata.org/entity/Q124862,Brabant Cloud ARK Identifier
477498ff-4183-5b2e-b862-4a25ae43bc03,religious_order,0,Franciscanessen van Heythuysen,Nederlands,Nederlands,https://n2t.net/ark:/15052/e135528a-3912-4aea-94b4-00974032eea2,Religious Order,"['O.S.F.', 'OSF', 'Sorores de Poenitentia ac Charitate Christiana Tertii Ordinis Sancti Francisci', 'Zusters van de Boetvaardigheid', 'Zusters van de Boetvaardigheid en van de Christelijke Liefde van de Derde Orde van de H. Franciscus']",http://www.wikidata.org/entity/Q3977239,Brabant Cloud ARK Identifier
be23a8d6-f12c-58b8-a055-62345c0f837f,religious_order,0,Congregatie der Missie,Primary,Nederlands,https://n2t.net/ark:/15052/0651af9b-8949-4235-9fe6-253d70b783fa,Religious Order,"['C.M.', 'CM', 'Congregatie der Missie', 'Congregatio Missionis', 'Lazaristen', 'Lazaristen CM']",http://www.wikidata.org/entity/Q849726,"""Brabant Cloud ARK Identifier"""
2ff3aa59-b894-5b20-8621-813794bb9970,religious_order,0,Missionarissen van het Heilig Hart van Jezus,Primary,Nederlands,https://n2t.net/ark:/15052/56ee0470-2872-40f4-8284-b3e15867e00d,Religious Order,"['Rooi Harten', 'Missionarissen van het H. Hart van Jezus', 'De Rooi Harten', 'M.S.C.', 'MSC', 'Missiehuis van het Heilig Hart', 'Missionarissen van het H. Hart', 'Missionarissen van het Heilig Hart', 'Missionarii Sacratissimi Cordis Jesu', 'Missionarissen van het Heilig Hart van Jezus MSC']",http://www.wikidata.org/entity/Q1615041,"""Brabant Cloud ARK Identifier"""
76293925-ec59-53ca-ab6e-6f2bc226b923,religious_order,0,Zusters Reparatricen,Primary,Nederlands,https://n2t.net/ark:/15052/497651f3-db07-4f28-847b-d1445f629117,Religious Order,"['Congregatie van Maria Eerherstel', 'Reparatricen', 'S.M.R.', 'SMR', 'Soeurs de Marie-Réparatrice', 'Congregatie van de Reparatricen', 'Zusters van Maria Eerherstel', 'Zusters van Maria Reparatrix', 'Zusters Reparatricen SMR']",http://www.wikidata.org/entity/Q3511740,"""Brabant Cloud ARK Identifier"""
ab1a0a0f-8e10-5031-828b-490a61cb5565,religious_order,0,Clarissen-Coletinen,Nederlands,Nederlands,https://n2t.net/ark:/15052/827485c4-4b9a-4e29-b75f-253345a52ddd,Religious Order,"['Clarissen-Coletinen OCC', 'Clarissen-Coletinen', 'Coletienen', 'Coletinen', 'Colettinen', 'Ordo Sanctae Clarae reformationis ab Coleta', 'Zusters Clarissen Coletienen', 'O.C.C.', 'OCC', 'Ordo Monialum Clarissae Reformationis a S. Coleta']",http://www.wikidata.org/entity/Q2535397,Brabant Cloud ARK Identifier
e4e38e20-ee61-577f-acec-898fc155076c,religious_order,0,Zusters van Maria en Jozef,Primary,Nederlands,https://n2t.net/ark:/15052/6f17bd52-a33c-4184-a928-d03d4638dd24,Religious Order,"['Zusters van Maria-Jozef', 'Soeurs de Marie-Jozef', 'Soeurs des Prisons', 'Zusters van Maria en Joseph']",,
e2b2d260-47ea-5d56-86df-862e9a6b2811,religious_order,0,Zusters Auxiliatricen,Nederlands,Nederlands,https://n2t.net/ark:/15052/23e37c6a-e663-4c94-a748-c272f2eeb31d,Religious Order,"['Auxiliatricen der Zielen in het Vagevuur', 'Auxiliatricen van de Zielen in het Vagevuur', 'Helpsters van de Zielen in het Vagevuur', 'S.A.', 'SA', 'Auxiliatricen']",http://www.wikidata.org/entity/Q656825,Brabant Cloud ARK Identifier
332cf875-706a-57b1-8791-75e69f3a79f1,religious_order,0,Franciscanen,Nederlands,Nederlands,https://n2t.net/ark:/15052/28c2bb4d-42f9-4bfc-aaf5-cf1266f8d8cb,Religious Order,"['Franciscaner Orde', 'Franciskanen', 'Minderbroeders', 'Minderbroeders franciscanen', 'Minnebroeders', 'Orde van de Minderbroeders', 'O.F.M.', 'OFM', 'Ordo Fratrum Minorum', 'Serafijnse Orde', 'Franciscanen OFM/OFMCONV']",http://www.wikidata.org/entity/Q165005,Brabant Cloud ARK Identifier
12cbfe8c-02e1-5aa6-a917-c2c55a26f2ae,religious_order,0,Franciscanessen van Denekamp,Nederlands,Nederlands,https://n2t.net/ark:/15052/492bbefd-c99d-490b-82bc-dfb6803dc8d8,Religious Order,"['Franciscanessen van de H. Martelaar Georgius', 'Franciscanessen van de H. Nicolaas', 'Franciscanessen van de Heilige Martelaar Georgius', 'Franciscanessen van de Heilige Nicolaas', 'Franciscanessen van Thuine']",http://www.wikidata.org/entity/Q113640722,Brabant Cloud ARK Identifier
c16daa9d-3e5e-55af-85f5-1261768bf620,religious_order,0,Broeders van de Heilige Norbertus van Elshout,Nederlands,Nederlands,https://n2t.net/ark:/15052/1cfd88b0-ea29-4b35-b186-5e95a6a88720,Religious Order,"['Broeders van de H. Norbertus', 'Broeders van de Heilige Norbertus', 'Broeders van Elshout']",http://www.wikidata.org/entity/Q2743945,Brabant Cloud ARK Identifier
4e7a4605-2234-584d-b95b-a46119e34415,religious_order,0,Zusters van Barmhartigheid (Geldrop),Primary,Nederlands,https://n2t.net/ark:/15052/8ae62b81-7516-4463-866e-0e82921e9abf,Religious Order,Zusters van Barmhartigheid van Cadier en Keer,,
b80f8a2d-59f7-5e67-b1a9-47fd7c453945,religious_order,0,Broedercongregatie Onze-Lieve-Vrouw van Zeven Smarten,Primary,Nederlands,https://n2t.net/ark:/15052/c11c558d-448c-4d6e-9575-446c2ab997ea,Religious Order,"['Broeders van Amsterdam', 'Broedercongregatie van Onze Lieve Vrouw van Zeven Smarten', 'C.S.D.', 'Congregatio Septum Dolorum', 'CSD', 'Broeders van Onze Lieve Vrouw van Zeven Smarten', 'Broeders van Onze-Lieve-Vrouw van Zeven Smarten', 'Broeders met de Blauwe Koorden CSD', 'Broeders van Onze Lieve Vrouw van Zeven Smarten CSD']",http://www.wikidata.org/entity/Q24037665,"""Brabant Cloud ARK Identifier"""
a1f1bebb-0459-5acb-a5b7-e4301bf8a4c0,religious_order,0,Zusters van de Goddelijke Verlosser (Deurne),Primary,Nederlands,https://n2t.net/ark:/15052/4bc31870-a41c-4848-897a-cca093442620,Religious Order,"['Zusters van de Goddelijke Verlosser FDS', 'Weense Zusters', 'Zusters van de Goddelijke Verlosser', 'Dochters van de Allerheiligste Heiland', 'Dochters van de Goddelijke Heiland', 'Zusters van de Allerheiligste Verlosser', 'Zusters van de Goddelijke Heiland', 'F.D.S.', 'FDS', 'Filiae Divini Salvatoris']",http://www.wikidata.org/entity/Q1791754,"""Brabant Cloud ARK Identifier"""
4cec54f9-55ec-59ec-8041-37a22abb1a77,religious_order,0,Zusters van de Heilige Geest (Koblenz),Primary,Nederlands,https://n2t.net/ark:/15052/d2a18d39-15ff-4a15-b835-17ada39d02c9,Religious Order,"['School- en Ziekenzusters van de Heilige Geest', 'S.H.Sp', 'SHSp', 'Zusters van de H. Geest (Koblenz)', 'Zusters van de H. Jozef', 'Zusters van de Heilige Jozef', 'Zusters van de H. Geest', 'Zusters van de Heilige Geest']",http://www.wikidata.org/entity/Q25409183,"""Brabant Cloud ARK Identifier"""
3e91442e-f16c-5f30-b1b9-8e145b77ff48,religious_order,0,Jezuïeten,Nederlands,Nederlands,https://n2t.net/ark:/15052/b9e6798d-6cfa-4011-816d-763712faa57d,Religious Order,"['Jezuïeten SJ', 'Sociëteit van Jezus', 'S.I.', 'S.J.', 'SI', 'SJ', 'Societatis Iesu', 'Societatis Jesu', 'Jezuïetenorde', 'Paters Jezuïeten']",https://www.wikidata.org/entity/Q36380,Brabant Cloud ARK Identifier
998c2b77-339b-5a38-8930-08f85b388411,religious_order,0,Penitenten van de Eenheid,Primary,Nederlands,https://n2t.net/ark:/15052/921fc212-46c4-4eb6-a923-5b9bd2425643,Religious Order,"['Congregatie der Zusters Penitenten der Hereniging', 'Franciscanessen van Haren', 'Franciscanessen van Megen', 'Zusters van de Derde Orde van de H. Franciscus', 'Zusters van de Derde Orde van de Heilige Franciscus', 'Penitenten (van de Eenheid)']",http://www.wikidata.org/entity/Q114775227,"""Brabant Cloud ARK Identifier"""
a1c7ddce-5b80-5149-bc13-e7beb4b96fe6,religious_order,0,Zusters van Onze Lieve Vrouw (Tegelen),Primary,Nederlands,https://n2t.net/ark:/15052/a78205c7-1b14-4f45-9e23-4fbe68c2dc91,Religious Order,"['Zusters van Onze Lieve Vrouw', 'S.N.D.', 'SND', 'Zusters van O.L. Vrouw (Tegelen)', 'Zusters van O.L. Vrouw van Tegelen', 'Zusters van Onze Lieve Vrouw van Tegelen', 'Zusters van O.L. Vrouw', 'Zusters van Onze-Lieve-Vrouw van Tegelen']",http://www.wikidata.org/entity/Q27526277,"""Brabant Cloud ARK Identifier"""
462cf695-30f8-5335-bff5-f7e182c3f761,religious_order,0,Missie- en Aanbiddingszusters van de Heilige Familie,Primary,Nederlands,https://n2t.net/ark:/15052/88f3d70e-3256-4aaf-bcf7-20998e93275d,Religious Order,"['Missie- en Aanbiddingszusters van de H. Familie', 'Missie- en Aanbiddingszusters van de H. Familie MASF', 'M.A.S.F.', 'MASF', 'Missio Adoratio Sancta Familia', 'Zusters van de H. Familie', 'Zusters van de Heilige Familie']",http://www.wikidata.org/entity/Q1939080,"""Brabant Cloud ARK Identifier"""
e960978d-1371-56c1-8a88-a1b9749a11b5,religious_order,0,Missionarissen van de Heilige Familie,Nederlands,Nederlands,https://n2t.net/ark:/15052/76b40ea2-8864-4f44-a173-5dad6ea6f390,Religious Order,"['Franse paters', 'Missionarissen van de H. Familie', 'Congregatio Missionariorum a Sacra Familia', 'M.S.F.', 'MSF', 'Paters van de H. Familie', 'Paters van de Heilige Familie', 'Missionarii a Sancta Familia', 'Missionarissen van de Heilige Familie MSF']",http://www.wikidata.org/entity/Q592792,Brabant Cloud ARK Identifier
7daf4bb3-91b8-5d95-b218-4d4f37d8ecec,religious_order,0,Liefdezusters van het Kostbaar Bloed,Primary,Nederlands,https://n2t.net/ark:/15052/b37c9929-1ec8-465a-a970-39bcd90d9f82,Religious Order,"['Dochters van het Kostbaar Bloed van Onze Heer Jezus Christus', 'Liefdezusters van het Kostbaar Bloed van Koningsbosch', 'Zusters van Koningsbosch']",http://www.wikidata.org/entity/Q5227962,"""Brabant Cloud ARK Identifier"""
eb57f0e4-0c95-53bb-9d26-845df39d6950,religious_order,0,Passionisten,Primary,Nederlands,https://n2t.net/ark:/15052/54b25a1b-4972-4613-bb30-ae53a7d556ec,Religious Order,"['Congregatie van het Lijden van Jezus Christus', 'C.P.', 'CP', 'Congregatie van het Allerheiligste Kruis en het Lijden onzes Heren Jezus Christus', 'Congregatio Clericorum Excalceatorum Sanctissimae Crucis et Passionis Domini Nostri Jesu Christi', 'Congregatio Passionis Jesu Christi', 'Passionisten CP']",http://www.wikidata.org/entity/Q774589,"""Brabant Cloud ARK Identifier"""
2117995f-b5e6-5c40-843d-15c4a559a382,religious_order,0,Zusters van de Goddelijke Verlosser (Esch),Primary,Nederlands,https://n2t.net/ark:/15052/93a66f07-ef2c-4103-acee-ce2ef5ae77b5,Religious Order,"['Zusters van de Goddelijke Verlosser', 'Zusters van de Allerheiligste Verlosser', 'Filiae Divini Salvatoris']",http://www.wikidata.org/entity/Q1791754,"""Brabant Cloud ARK Identifier"""
443f357b-2e68-5777-b62c-f8c36e1a6f6f,religious_order,0,Missionarissen van Scheut,Nederlands,Nederlands,https://n2t.net/ark:/15052/4598a5a6-632a-4dfa-a383-ba8a39f6a0fc,Religious Order,"['Missionarissen van Scheut CICM', 'Congregatie van het Onbevlekt Hart van Maria', 'Congregatio Immaculati Cordis Mariae', 'Scheutisten', 'Missie-Congregatie van het Onbevlekt Hart van Maria', 'C.I.C.M.', 'CICM']",http://www.wikidata.org/entity/Q1463319,Brabant Cloud ARK Identifier
102d4f56-ea7a-515b-ad30-0d7ea7b643ce,religious_order,0,Missionarissen van het Goddelijk Woord,Nederlands,Nederlands,https://n2t.net/ark:/15052/f2c8863e-55fb-4a3d-a0c6-90e4e7ff3de2,Religious Order,"['Missionarissen van het Goddelijk Woord SVD', 'Missiepaters van Steyl', 'Paters van Steyl', 'Missionarissen van Steyl', 'S.V.D.', 'SVD', 'Societas Verbi Divini', 'Gezelschap van het Goddelijk Woord']",http://www.wikidata.org/entity/Q696656,Brabant Cloud ARK Identifier
c66624c0-d195-51aa-bbf6-2a8c6f92053c,religious_order,0,Broeders van Barmhartigheid van Sint-Joannes de Deo,Nederlands,Nederlands,https://n2t.net/ark:/15052/b8b295bb-f0f0-481d-b006-ba8c1bfbc2a6,Religious Order,"['Barmhartige Broeders van Montabaur', 'Barmherzige Brüder von Montabaur', 'Broeders van Barmhartigheid van Sint Joannes de Deo', 'Broeders van Barmhartigheid van St. Joannes de Deo', 'Broeders van de H. Joannes de Deo', 'Broeders van de Heilige Joannes de Deo', 'Congregatio Fratrum Misericordiae de Montabaur', 'Fratres Misericordiae Montabaur', 'Broeders van Barmhartigheid van Sint-Joannes de Deo FMM', 'Broeders van Joannes de Deo', 'F.M.M.', 'FMM']",http://www.wikidata.org/entity/Q662569,Brabant Cloud ARK Identifier
361ebe52-343c-563c-83ae-69cac228fc6b,religious_order,0,Redemptoristen,Nederlands,Nederlands,https://n2t.net/ark:/15052/f74d16f7-c3e4-4cb0-9657-7af729887a34,Religious Order,"['C.Ss.R.', 'Congregatie van de Allerheiligste Verlosser', 'CSsr', 'Redemptoristen', 'Congregatio Sanctissimi Redemptoris', 'CSSR', 'Redemptoristen CSSR']",https://www.wikidata.org/entity/Q751148,Brabant Cloud ARK Identifier
1aa2f740-bf83-5551-8d79-e1173e483c33,religious_order,0,Broeders van de Heilige Joseph,Primary,Nederlands,https://n2t.net/ark:/15052/1b3b28bd-2350-4958-bfc9-4f4f88f60aa5,Religious Order,"['Broeders van Heerlen', 'Broeders van de H. Joseph', 'Broeders van de H. Jozef', 'Broeders van de Heilige Jozef', 'Broeders v.d. H. Jozef']",http://www.wikidata.org/entity/Q2202448,"""Brabant Cloud ARK Identifier"""
6570cc1f-5e36-5ce5-8ba7-0f3b79947fb0,religious_order,0,Franciscanessen van Erlenbad,Nederlands,Nederlands,https://n2t.net/ark:/15052/2533e5fa-cb87-41e4-8ab2-9d2530085029,Religious Order,"['Schoolzusters van Sint-Franciscus', 'O.S.F.', 'OSF', 'Schoolzusters van Sint Franciscus', 'Schoolzusters van St. Franciscus', 'S.S.S.F.', 'SSSF']",https://www.wikidata.org/entity/Q870612,Brabant Cloud ARK Identifier
a39e44df-be2c-532b-bde4-de527c0b890b,religious_order,0,Broeders van Maastricht,Primary,Nederlands,https://n2t.net/ark:/15052/73ed9cf1-2d6f-4e7d-9417-62767ea7b359,Religious Order,"['Broeders van Maastricht FIC', 'Broeders van de Onbevlekte Ontvangenis van Maria', 'Broeders van de Beyart', 'Congregatio Fratrum Immaculatae Conceptionis Beatae Mariae Virginis', 'F.I.C.', 'Meesters uit Maastricht', 'Broeders van de Onbevlekte Ontvangenis van de H. Maagd Maria', 'Broeders van de Onbevlekte Ontvangenis van de H. Maagd Maria onder bescherming van de H. Vincentius à Paulo', 'Congregatie van de Broeders van de Onbevlekte Ontvangenis van de H. Maagd Maria', 'FIC']",https://www.wikidata.org/entity/Q337791,"""Brabant Cloud ARK Identifier"""
39bc53d1-2671-5a3d-937c-d68e34a64a9f,religious_order,0,Missiezusters van de Heilige Geest,Primary,Nederlands,https://n2t.net/ark:/15052/ebdafb40-212e-40bc-82a2-dddf6376b73d,Religious Order,"['C.S.S.P.', 'CSSP', 'Missiezusters van de H. Geest', 'Missionnaires du Saint Esprit (de Boulogne-sur-Seine)', 'Spiritaines', 'Missiezusters van de H. Geest CSSP', 'Missiezusters van de Heilige Geest CSSP']",,
459e3814-c3e2-5f37-ae24-9b56a78c3250,religious_order,0,Camillianen,Primary,Nederlands,https://n2t.net/ark:/15052/b154f63f-e9c5-4838-beef-75f0258ca086,Religious Order,"['M.I.', 'MI', 'O.S.Cam.', 'Orde der Reguliere Clerici voor de Zieken', 'Ordo Clericorum Regularium Ministrantium Infirmis', 'OSCam', 'Vaders van de Goede Dood', 'Dienaren der zieken', 'Camillianen OSCAM', 'Orde van de Reguliere Geestelijken', 'Reguliere Geestelijken ter Ziekenverpleging', 'CCRRMMII', 'CRMI', 'Orde der Camillianen', 'Orde van Reguliere Clericale Dienaren der Zieken', 'Paters van de Zalige Dood']",http://www.wikidata.org/entity/Q915029,"""Brabant Cloud ARK Identifier"""
085994b2-2c1b-5486-bec7-6af29e256378,religious_order,0,Zusters van de Choorstraat,Nederlands,Nederlands,https://n2t.net/ark:/15052/f97d6c5b-e714-42d3-8ffe-5c497fdeb758,Religious Order,,,
310cdf0f-9da4-5447-9348-69a6dfc385fd,religious_order,0,Kartuizers van Vught,Primary,Nederlands,https://n2t.net/ark:/15052/65221173-f75d-4512-82dc-bf2fb75af159,Religious Order,Karthuizers van Vught,,
49adc653-ca65-5406-a35d-e4fcea043917,religious_order,0,Maristen,Primary,Nederlands,https://n2t.net/ark:/15052/59130d1e-9eab-4c61-b468-bc0ecc9cdc89,Religious Order,"['Paters Maristen', 'S.M.', 'SM', 'Societas Mariae', 'Sociëteit van Maria', 'Maristen SM']",http://www.wikidata.org/entity/Q923103,"""Brabant Cloud ARK Identifier"""
392571aa-9d35-5272-b639-61ed8672479f,religious_order,0,Birgittinessen,Nederlands,Nederlands,https://n2t.net/ark:/15052/f12ff24b-6a9a-40d3-8194-cb430be4515f,Religious Order,"['Orde van Sint Birgitta', 'Orde van St. Birgitta', 'Orde van de Allerheiligste Verlosser', 'O.Ss.S', 'Orde van Sint-Birgitta', 'Ordo Sanctissimi Salvatoris', 'OSsS', 'OSSS', 'Birgittinessen OSSS']",http://www.wikidata.org/entity/Q952578,Brabant Cloud ARK Identifier
babc4ba1-05d6-57d2-b95b-974e83a40d08,religious_order,0,Birgittijnen,Nederlands,Nederlands,https://n2t.net/ark:/15052/0e788c26-f53c-4d62-9ed2-e42a2384e392,Religious Order,,,
42514983-0626-5a5f-93cd-a4d0131532f1,religious_order,0,Broeders van Drunen,Nederlands,Nederlands,https://n2t.net/ark:/15052/d56fdbaa-3f8b-4077-ac22-f3371be0da10,Religious Order,,,
4a7f23c5-9c73-58db-af33-a6b011407aa7,religious_order,0,Cisterciënzers,Primary,Nederlands,https://n2t.net/ark:/15052/47b34c6c-44b3-4fb3-80d8-10d3671e056a,Religious Order,"['Orde der Cisterciënzers', 'O.Cist.', 'OCist', 'SOCist', 'Bernardijnen', 'Cisterciënzen', 'Cistercienzers', 'Grijzemonniken', 'Ordo Cisterciensis', 'Schieremonniken', 'SOC', 'Cisterciënzers OCIST']",https://www.wikidata.org/entity/Q166861,"""Brabant Cloud ARK Identifier"""
089e5190-a80d-5db9-8d22-18517553e516,religious_order,0,Oblaten van de Heilige Franciscus van Sales,Primary,Nederlands,https://n2t.net/ark:/15052/3107d820-feb7-4231-8e5b-7b98062b862e,Religious Order,"['Institutum Oblatorum Sancti Francisci Salesii', 'O.S.F.S.', 'Oblaten van de H. Franciscus van Sales', 'OSFS']",http://www.wikidata.org/entity/Q7075133,"""Brabant Cloud ARK Identifier"""
1cf20b8b-227b-59b8-bc0b-9093ee0fa901,religious_order,0,Reguliere Kanunniken van Sint-Augustinus,Nederlands,Nederlands,https://n2t.net/ark:/15052/48c88f17-a64f-4d70-aa58-8f0bed43ebe3,Religious Order,"['C.R.L.', 'Canonici Regulares Lateranenses', 'Congregatie van Lateranen', 'CRL', 'Lateraanse Congregatie', 'Reguliere Kanunniken van de H. Augustinus', 'Reguliere Kanunniken van de Heilige Augustinus', 'Reguliere Kanunniken van Sint Augustinus', 'Reguliere Kanunniken van Sint Jan van Lateranen', 'Reguliere Kanunniken van Sint-Jan van Lateranen', 'Reguliere Kanunniken van St. Augustinus', 'Reguliere Kanunniken van St. Jan van Lateranen', 'Congregatie der Reguliere Kanunniken van de Allerheiligste Verlosser van Lateranen', 'Reguliere Kanunniken van Lateranen']",http://www.wikidata.org/entity/Q635046,Brabant Cloud ARK Identifier
185d711c-e686-5d09-b40c-443d2263263c,religious_order,0,Zusters van Onze Lieve Vrouw van het Cenakel,Nederlands,Nederlands,https://n2t.net/ark:/15052/0c702c69-a428-4ddb-b111-656e6bb3eb4c,Religious Order,"['Zusters van O.L. Vrouw van het Cenakel', 'Zusters van het Cenakel', 'Zusters van Onze Lieve Vrouw der Afzondering in het Cenakel', 'Zusters van Onze-Lieve-Vrouw der Afzondering in het Cenakel', 'Zusters van O.L. Vrouw van het Cenakel FC', 'Zusters van Onze Lieve Vrouw van het Cenakel FC']",http://www.wikidata.org/entity/Q3344726,Brabant Cloud ARK Identifier
84ed4fb7-045d-56d8-85a7-67d9ec7fd9ea,religious_order,0,Dominicanen,Primary,Nederlands,https://n2t.net/ark:/15052/cc8b72de-5993-42fb-8d39-1c257225eb76,Religious Order,"['Dominicanen OP', 'O.P.', 'OP', 'Orde der Predikheren', 'Ordo Praedicatorum', 'Dominicaner orde', 'Predikheren', 'Preekheren', 'Ordo Fratrum Praedicatorum', 'Predikbroeders']",http://www.wikidata.org/entity/Q131479,"""Brabant Cloud ARK Identifier"""
237dba34-15a7-5663-a503-8d5dcb4ae51a,religious_order,0,Dominicanessen van de Heilige Familie,Primary,Nederlands,https://n2t.net/ark:/15052/67c1d721-8ca5-490c-b2e0-6c9f9228ac6c,Religious Order,"['O.P.', 'OP', 'Dominicanessen van de Heilige Familie OP', 'Dominicanessen van de Heilige Familie, Jezus, Maria en Jozef', 'Dominicanessen van Neerbosch']",http://www.wikidata.org/entity/Q114766474,"""Brabant Cloud ARK Identifier"""
6fbca2e0-2af3-564b-bcc0-156d2a894dd3,religious_order,0,Montfortanen,Primary,Nederlands,https://n2t.net/ark:/15052/c2b93604-7abc-4ffb-804b-994ca83c617e,Religious Order,"['Montfortanen SMM', 'S.M.M.', 'Paters Montfortanen', 'Compagnie de Marie', 'Missionarissen van het Gezelschap van Maria', 'Gezelschap van Maria', 'SMM', 'Societas Mariae Montfortana']",https://www.wikidata.org/entity/Q1246707,"""Brabant Cloud ARK Identifier"""
deacc0c5-d09b-56bf-8524-bdaa09598c0c,religious_order,0,De Zusters van Barmhartigheid (Maastricht),Primary,Nederlands,https://n2t.net/ark:/15052/5e62c2b1-016c-4c80-b877-1f1d55b38d03,Religious Order,,,
